press,article
중앙일보,"“당신들 로프 없이 번지점프를 하고 있군.” 빌 클린턴 대통령의 참모였던 조지 스테퍼노펄러스에게 아버지 부시 대통령의 연설문 작성자였던 토니 스노가 외쳤다는 말이다. 전후 사정은 이랬다. 1993년 어느 날 오후 9시 클린턴 대통령이 집무실에서 세금 관련 연설을 했다. 직전까지 첨삭해 연설문을 프롬프터에 끼워 넣은 건 8시48분이었다. 대통령이 급하게 혼자 연습했다. 스테퍼노펄러스는 직후 역대 대통령들의 연설문 담당자들의 모임(저드슨웰리버 소사이어티)에 갔다. 그가 상황을 설명하자 다들 못 믿겠다는 듯이 고개를 떨구었다고 한다. 그러다 리처드 닉슨 대통령의 팻 뷰캐넌이 입을 열었다. “그, 그러니까, 자네 말은… 대통령이 9시10분 전까지 한 번도 연습하지 않았다는 건가?” 여기저기서 수군댔다. 그러다 나온 외침이 ‘로프 없는 번지점프’였다. 이들의 표현법을 빌리면 윤석열 대통령의 도어스테핑(약식 기자회견)은 훨씬 더 높은 곳에서 로프 없이 번지점프를 하는 격이다. 클린턴은 보고 읽은 거지만 윤 대통령은 즉흥 문답이어서다. 그것도 매주 두세 차례나. 많은 이들이 궁금할 것이다. 고도로 정교하고 전략적이어야 할 대통령 발언이니 예상 질문과 답변(Q&A)을 통해 대비하지 않느냐고 말이다. “대통령 처음 해봐서”라든가, “법조인이 폭넓게 정·관계에 진출하는 게 법치국가” “전 정권에서 지명된 장관 중에 그렇게 훌륭한 사람 봤느냐” 등등 상상 외의 답변을 마주하니 누구나 가질 법한 의문이다. 대통령실에 따르면 Q&A가 없는 건 아니다. 처음엔 대변인실 중심으로 만들었다고 한다. 윤 대통령이 그걸 따르지 않았다. 나중에 질문만 달라고 했다. 대통령 스스로 아침마다 청와대 참모와 장관들에게 직접 물어서 답하곤 했다. 그러다 논란이 일자 다른 팀이 투입됐다고 한다. 이번에도 대통령은 며칠 지나지 않아 질문만 달라고 했다고 한다. 윤 대통령의 준비 과정이 얼마나 독특한지 데이비드 캐머런 전 영국 총리의 ‘총리 질문(PMQ·Prime Minister's Questions)’과 비교하면 알 수 있다. PMQ는 총리가 매주 수요일 낮 12시부터 30분간 의회에서 야당 당수를 포함한 의원들과 하는 문답으로 능변의 캐머런도 “무섭다”고 했던 제도다. 그는 이렇게 대비했다. “월요일엔 참모들과 개괄적인 대화를 나눈다. 화요일엔 정책 참모(관료 포함)들과 예닐곱 개 핵심 주제를 포함, 현안에 대해 논의한다. 저녁때 두툼한 관련 서류철이 도착하면 이를 보며 잠자리에 든다. 수요일 아침 회의 후 주요 장관들·PMQ팀과 토의한다. 이때 재치 있는 표현들을 추가한다. 의회엔 오전 10시30분에 도착, 혼자 다시 서류를 정리한다. 가위와 칼, 테이프로 오려 붙이기도 한다. 반면에 윤석열 정부의 상징과도 같은 도어스테핑을 윤 대통령이 혼자 준비한다? 이해 불가다. 자신감이라고? 만용이다. 윤 대통령은 정치적 수사에 능숙하지도 않다. 다변일지언정, 의도를 정확히 전달하는 달변은 아니다. 최근 논란이 된 발언들을 두고도 참모들이 “진의는 달랐다”고 주장한다. 고용노동부의 주 52시간제 발표와 관련, “정부 방침 아니다”고 한 건 야당과 진보 진영이 공격 소재로 삼은 “주 92시간까지 일할 수 있다”는 부분이라고 한다. “여론조사 의미 없다”도 일희일비하지 않겠다는 취지로 하다 튀어나온 말이라고 한다. 유사한 지적이 정치 입문 시절부터 있었는데도 안 달라진 걸 보면 윤 대통령의 고집도 이만저만이 아니다. 사실 윤석열 정부의 방향성 자체는 나쁜 편이 아니다. 한·미 동맹 중시 등 외교안보 스탠스는 안정적이고, 재정건전성 강조나 연금·교육·노동개혁 포부는 바람직하다. 하지만 윤 대통령의 말이 불필요한 혼란과 위기를 만들어내고 있다. 다른 누구도 아닌 윤 대통령이 마음을 고쳐먹어야 한다."
국민일보,"윤석열 대통령이 얼마 전 문재인정부의 탈원전 정책에 대해 “바보 같은 짓”이라고 말했다. 그걸 보면서 윤 대통령이 대검찰청 중앙수사부 수사과장이던 약 10년 전 그를 취재하던 때가 떠올랐다. 어떤 사안에나 거침없이 자기 의견을 직설하는 강골 검사였다. 2013년 그가 “나는 사람에게 충성하지 않는다”는 트레이드 마크와 같은 발언을 한 것도 이런 성향에서 나온 것이다. 그때는 그게 장점으로 작용하는 듯 보였다. 상명하복의 검찰 조직에서 할 말은 한다는 태도에 많은 후배가 따랐고, 기자들은 수사 분위기라도 유추해볼 수 있는 그의 화법을 어떤 면에서 다행스럽게 여겼다. 그런데 대통령의 자리에서도 비슷한 방식으로 말을 쏟아내고 있다. 당시 그는 검찰 조직의 구성원에 불과했다. 이제 그는 국가 원수이자 행정부 수반이다. 한 검사가 사석에서 탈원전 정책을 가리켜 ‘바보짓’이라고 한다면 그냥 그런 생각을 가진 한 사람으로 보고 대수롭지 않게 넘길 수 있다. 검사도 공무원이지만 수사와 직접 관련이 없는 특정한 정책에 대해 자유롭게 말할 자유를 가지고 있다. 또 탈원전 정책을 지지하는 사람이 그 검사 앞에서 그 말을 듣고 있다가 바보라는 표현을 불쾌해하거나 항의할 가능성도 매우 작다. 대통령 발언은 다르다. 공석에서 한 대통령의 발언은 모든 국민에게 알려질 수 있다. 윤 대통령의 말은 탈원전 정책이 잘못됐다는 강한 신념에서 나왔을 것이다. 바보짓이라 할 게 아니라 타당한 근거를 바탕으로 현재 시점에서 비합리적이라거나 바람직하지 않다고 하는 정도면 충분하다. 바보짓이란 말은 어떤 상황에서 누가 들어도 기분이 언짢아질 수 있는 말이다. 품위를 잃은 표현인 데다 다른 사람을 존중하는 최소한의 태도도 갖추지 못했기 때문이다. 2019년 한 조사 기관이 국민 4000여명을 대상으로 한 설문조사에 따르면 탈원전 정책의 필요성에 공감하는 비율은 40.9%였다. 보통은 35.8%였고 공감하지 않는다는 응답은 23.3%였다. 윤 대통령의 말대로라면 절반에 가까운 사람은 바보짓을 지지한 것이 된다. 윤 대통령이 의도하지 않았겠지만 탈원전 정책을 지지하는 사람들은 그 말에 매우 불쾌했을 것이다. 더 큰 문제는 윤 대통령이 탈원전 정책이 담고 있는 다양한 의미와 가치를 전혀 고려하지 않고 있다는 인상이다. 윤석열정부는 지난해 전체 발전원에서 27.4%를 차지했던 원전 비율을 30% 이상으로 확대하기로 했다. 문재인정부의 탈원전 정책 폐기를 공식화한 것이다. 이 시점에서 다수 국민이 알고 싶은 것은 현 정부가 정책 방향을 선회하는 이유다. 기후 이상에 따른 폭염으로 매년 전력 수요가 최고치를 갈아치우고, 원전업체들이 고사 직전까지 내몰리며 원전 관련 산업계가 위기에 처한 현실을 고려해 원전 비중 재설정은 불가피할 수 있다. 하지만 탈원전을 지지하던 국민은 여전히 걱정을 안고 있다. 원전을 불안해하는 가장 큰 이유는 안전이다. 일본 후쿠시마 원전 사고는 10년이 넘었는데도 현재 진행형이다. 원전 앞바다 물고기에서 아직도 기준치를 초과하는 방사능이 검출되고 있다. 게다가 우리는 지난 40년간 사용후핵연료 영구처분시설 문제를 해결하지 못하고 제자리걸음이다. 그렇다면 원전 확대는 이 땅에서 살아갈 미래 세대의 짐을 가중시키는 일이다. 정책 조율자인 대통령은 어떤 정책을 버리고 새 방향을 제시할 때 설명하고 설득해야 한다. 바보짓이라 할 게 아니다. 최근 인사 문제도 해명이나 사과 대신 ‘전 정권 장관보다 낫다’는 식의 거친 말을 뱉었다. 여론을 경청하고 정책을 조정할 대통령의 태도로 매우 우려스럽다."
프레시안,"1972년 7월 4일 아침 10시, TV 화면에 상상도 못했던 장면이 펼쳐졌다. 서울과 평양에서 동시에 발표된 자주·평화·민족대단결이라는 통일의 3원칙, 반공의 보루 중앙정보부장 이후락이 비밀리에 평양에 가서 김일성을 만났다는 이야기 등이 생중계되었다. 불과 4년 전인 1968년 1월 북한군 특수부대가 박정희 대통령을 살해하기 위해 청와대 바로 앞까지 침투했다가 저지되었다. 그 이틀 후에는 미국 정보선 푸에블로호가 원산 앞바다에서 북한에 의해 나포되어 미국의 항공모함이 무려 3척이나 동해에 나타나는 등 제2의 한국전쟁이 우려되었다. 그런 만큼 7.4공동성명 발표는 매우 극적인 역사적 전환이었다. 분단 이후 남북한 당국이 합의해서 발표한 최초의 성명이었고, 남북대화라는 영역을 처음 펼쳐놓은 역사적 사건이었다. 그런데 올해가 7.4남북공동성명 50주년이라고 하면 사람들의 반응이 어떠할까? 시큰둥할 것이다. 지난 50년 동안 여러번 남북대화가 시도되고, 남북의 지도자가 손을 잡고, 술잔을 부딪치고 노래 부르며 냉면도 먹고 했지만, 남북대화는 언제나 기대와 실망을 동시에 안겨주었다. 한동안 잘해왔던 금강산 관광도 개성공단도 다 문 닫았다. 2018년 평창동계올림픽을 계기로 남북정상회담이 연달아 열리고, 트럼프 대통령과 김정은 위원장이 만나기도 하면서 이번에는 뭔가 다른 듯 했다. 하지만 2020년 6월 북한의 남북연락사무소 폭파, 역시나였다. 이처럼 가다 서다를 반복하면서도 지난 50년간 남북이 대화를 계속해온 이유는 무엇일까?  1970년대 초 남북한이 대화와 접촉에 나선 이유는 복합적이었지만, 역시 가장 중요한 것은 데탕트라는 국제정세의 변화, 구체적으로는 미국과 중국의 관계 개선에 대처하기 위해서였다. 1960년대 말부터 유럽과 일본이 성장하고 소련과 중국이 갈라서면서 국제질서는 미소 양극구도가 완화되고 좀더 다극화되는 양상이었다. 유럽 국가들은 미국과의 동맹관계에만 의존하는 것이 아니라 기존 냉전의 틀을 넘어서는 보다 유연하고 현실적이며 다변적인 외교적 행보를 보였다. 한국정부도 이미 1960년대 말부터 국제정세의 다극화를 이야기하며 좀더 유연하고 다변화된 정책을 추구하려는 움직임이 있었다. 남북한 사이의 '선의의 경쟁'을 촉구한 1970년 8.15평화통일구상선언이 바로 그것이다. 현재 공개된 한국의 외교문서 등에서도 확인되듯이 당시 중앙정보부와 외교부 등 실무부서는 8.15선언을 준비하면서 북한에 남북 교류를 제안하자는 안을 내놓았다. 북한의 실체를 인정하는 것이라 해서 남북 교류 자체를 완전히 거부했던 이전의 반공적 사고와 정책에서 획기적인 전환을 시도한 것이다. 그러나 반공법 등 관련 법률과의 충돌을 문제 삼는 법무부 관계자들이 반대해 제안은 최종결정 단계에서 보류되었다. 이처럼 남북의 교류와 접촉은 참으로 어렵고 다사다난했다. 그러던 중 1971년 7월 키신저 미 안보담당보좌관의 베이징 비밀 방문을 시작으로 미국과 중국의 관계 개선은 완전히 가시화되었고, 마침내 다음해 2월 닉슨 대통령이 베이징을 방문했다. 미국과 중국은 한국전쟁 때 한반도에서 격돌했던 나라였다. 관계 개선 과정에서 두 나라가 한반도 문제를 논의할 가능성이 틀림없이 있었고, 현재 공개된 미국 외교문서를 보면 실제 그러했다. 당시 두 강대국은 관계 개선을 위해 극단적인 긴장상태에 있는 한반도 상황을 일단 안정시킬 필요가 있었기 때문이다. 이에 각자의 동맹국에 데땅뜨 분위기에 맞는 유연한 정책을 종용하고 유도했다. 키신저의 베이징 방문 직후 남북한 모두 상대 정부와의 대화나 접촉을 거부했던 정책을 수정했고, 1971년 9월 판문점에서 이산가족 문제 해결을 위한 남북적십자 예비회담이 시작되었다.  그런데 당시 남북대화는 국제정세의 변화와 동맹국의 종용에 순응하는 차원에서만 결정된 것은 아니었다. 여기에는 확실히 좀더 능동적인 측면이 작동했다. 당시 중앙정보부장 이후락은 남북대화가 시작될 무렵 주한미국대사에게 ""과거의 한국은 후진성에 굴복하여 장기판의 졸(卒)과 같은 희생자 역할을 수행했지만, 오늘의 한국은 그럴 필요가 없다. 한국은 적극적이고 긍정적이며 어느정도 독립적인 역할을 할 수 있다""고 말했다. 미중이 장기판을 차려놓고 협상을 하는 상황에서 남북한이 가만히 있으면, 그 판의 '졸'이 되기 십상이다. 그러니 남북한도 분단 이후 처음으로 나름대로 남북대화라는 장기판을 차리고 7.4공동성명을 통해 본격적으로 게임의 주체로 등극했던 것이다. 7.4공동성명과 현재 사이에는 50년의 간극이 있고, 그동안 세계는 또 다시 바뀌었다. 소련과 유럽 공산주의체제는 붕괴되었지만, 중국의 부상으로 이제 미중 갈등과 경쟁에 의한 '신냉전'이 우려되는 상황에 놓여 있다. 이러할 때 우리는 어떻게 해야 할까? 되지도 않는 것 같은 남북대화는 팽개치고 미국과의 동맹관계만 강화하면 될 것인가? 그런데 누가 자신에게 전적으로 의존하는 사람을 제대로 존중해줄까? 지금 한국은 중국과의 경제적 관계가 매우 중요해졌는데, 이 문제는 또 어떻게 할 것인가? 중국으로부터 존중받기 위해서라도 남북대화라는 영역을 마련하고 유지할 필요가 있지 않을까? 특히 최근 우크라이나 전쟁은 21세기에도 전면전, 침략전이 현실화될 수 있다는 점을 잘 보여주고 있다. 그간 남북관계가 적대적 대치국면에서 무력충돌과 전쟁위기로 치닫게 되면 그것을 일단 모면하고 상황을 안정시키기 위해 남북대화를 진행한 측면도 있어왔다. 7.4공동성명 때도, 북한 핵 위기 국면에서도 그러했다. 남북대화의 역사는 문제를 제대로 해결하지 못하고 다시 반복하는 어리석음을 보여주지만, 한편 그렇게 해서라도 최악의 위기를 그때그때 모면해왔던 지혜의 역사이기도 하다. 남북대화는 왜 하는가? 한반도의 사람들이 자신의 운명을 스스로 결정 짓는 주체가 되기 위해서 한다. 한반도에서 전쟁을 방지하고 평화를 향상하는 데 필수적이기 때문에 한다. 그렇기에 2022년을 7.4공동성명 50주년으로 기억하는 것을 어색하게 생각하지 않았으면 한다."
한겨레,"“푹푹 찌는 와중에 납량 소식 하나 전하자면, 윤석열 대통령이 취임한 지 두 달밖에 안 됐다는 사실이야.” 한 친구의 이런 안부 ‘까똑’에 다른 친구가 답했다. “으, 그만해. 더 더워.” 친구들과 나는 나토 정상회의에 다녀온 대통령 내외의 B컷 사진들이 공개되자마자 눈치채버렸다. 이 사진을 고른 이는 적어도 1990년대 초중반을 풍미한 ‘조크든요’ 감성의 소유자라는 사실을 말이다. 구도며 시선에서 무엇을 돋보이게 하려는지 느낌 훅 온다. ‘쿨내 진동’을 위해 뜨겁게 애쓴 수고로움이 느껴진다. 대통령 열일하시고요, 여사님 우아하시고요, 두 분은 쿨하고 다정해요. 21세기의 대통령실에서 20세기 느낌으로 일하는 실무진을 따로 두지는 않을 것 같은데, 그렇다면 대통령과 아주 가까운 거리에 ‘그때 그 감성’의 소유자가 있는 걸까? 그 또래인 김건희 여사와 한동훈 법무부 장관? 만약에, 혹시나, 김건희 여사가 이런 식의 홍보에 관여한다면, 우리는 앞으로도 종종 기이하고 우스꽝스러운 ‘타임슬립’을 경험할 것 같다. 대통령은 칭찬에 민감한 분이다. 그런데 우리가 너무했다. 머나먼 유럽 출장에 다녀오신 분에게 지지율 반등은커녕 부정평가가 긍정평가를 앞서는 ‘데드크로스’를 대뜸 안겼으니 말이다. 안 그래도 지난 정권에 여러모로 콤플렉스가 있는 분 아닌가. 그게 아니라면 2022년 7월4일 출근길 약식 회견에서 검찰 수사 대상에 오른 김승희 보건복지부 장관 후보자를 어찌할지 묻는 말에 “빈틈없이 사람을 발탁했다고 자부한다”며 난데없이 “전 정부에 비교할 바는 아니다”라고 동문서답했을 리 없다. 그다음 날에는 만취운전 경력으로 여당 안에서도 우려가 나왔던 박순애 교육부 장관 등을 놓고 “전 정권에 지명된 장관 중에 그렇게 훌륭한 사람 봤느냐”며 날을 세웠다. 그는 이날 성급히 질문을 끊거나 “다른 정권 때하고 한번 비교를 해보라”고 다소 감정적으로 손가락을 흔들기도 했다. “지지율은 큰 의미 없다, 국민만 생각한다”고 애써 의연한 척했지만, 하루 만에 의연하지 않은 심경을 온 국민이 봤다. 빠른 결단과 실행력이 나름 검찰 시절부터 갈고닦은 대통령의 장점일 텐데 인사 난맥과 부실 검증에서는 그게 영 작동하지 않는 게 안타깝다. 고집과 오기가 도드라진다. 본인도 의식하는 것 같다. 국회 인사청문회도 없이 임명을 강행한 교육부 장관 임명장 수여식에서 대통령은 “언론과 야당의 공격 받느라 고생 많이 했다”며 “소신껏 잘하라”고 못박듯이 말했다. 어떤 심정이었는지 신임 장관은 눈 한번 제대로 마주치지 못했다. 두 달 넘도록 내각 구성조차 온전히 못하고 있다. 부적격자를 제대로 걸러내지도 빠르게 주저앉히지도 못했다. 공사를 뒤섞는 건 내내 화근거리다. 대통령실 인사비서관의 배우자가 기타 수행원으로 해외 순방에 동행한 것이 알려지자, 대통령실은 처음엔 “무보수의 자원봉사자”라더니 그 뒤엔 “전체 일정을 기획하고 지원했다”고 말을 바꿨다. 아니, 무슨 자원봉사자가 순방 일정을 기획하고 지원하나. 억지스럽게 일하고 그걸 또 감추려다보니 탈이 나는 것이다. ‘그럴듯한 포장’에 급급해 사적 인연을 끌어올 게 아니라 ‘내용에 충실하게’ 참모진을 잘 꾸리고 충언을 들을 일이다. 정치는 상대가 있으나 상대만 보고 해선 안 된다. 윤석열 대통령 마음속의 ‘준거 집단’ 혹은 ‘준거 인물’은 온통 전 정권과 문재인 전 대통령으로 보인다. 오죽하면 여당 안에서도 쓴소리가 나올까. 박민영 국민의힘 대변인은 “‘민주당도 그러지 않았느냐’는 대답은 민주당의 입을 막는 논리가 될 수는 있겠지만 국민의 물음에 대한 답변은 될 수 없다”고 말했다. 이러다가 대통령 입에서 조만간 ‘전 정권도 그 전 정권 탓했다’ ‘문재인은 박근혜 탓 더 했다’는 말이 나오지 않을까. 혹시 대통령은 아직도 전 정권과 싸우는 중이신지. 당신은 이겼고, 우리는 진도를 나가야 한다."
